{"assessment_id":"AEG-ASMT-D9F74C7A0F28F89BD7C55E20","created_at":"2026-07-21T18:57:21.012008+00:00","events":[{"actor_id":"aegissec-dynamic-orchestrator","actor_type":"SYSTEM","event_hash":"43a0f2f03b433925eb477a8a4a6813a8b86a826d807a0909c652dabe8d282976","event_id":"AEG-EVT-F61F3BD8A3AC620E413C","event_type":"RUN_CREATED","from_status":null,"message":"Assessment run ledger created.","metadata":{"asset_context_id":"AEG-AST-HOSP-SCHED-001"},"previous_event_hash":"0000000000000000000000000000000000000000000000000000000000000000","reason_code":null,"sequence":1,"stage_id":null,"timestamp":"2026-07-21T18:57:21.012008+00:00","to_status":null},{"actor_id":"aegissec-dynamic-orchestrator","actor_type":"ENGINE","event_hash":"6ee48329cc90cba0df60b1abfbfba6b1081e3141dfc1e97ba761ebda721d6e02","event_id":"AEG-EVT-B79AC5285E4B39320E4E","event_type":"STAGE_TRANSITION","from_status":"PENDING","message":"Executing governed adapter for INTAKE_VALIDATION.","metadata":{"adapter_name":"intake_validation_adapter","adapter_registered":true,"outputs":[],"warnings":[]},"previous_event_hash":"43a0f2f03b433925eb477a8a4a6813a8b86a826d807a0909c652dabe8d282976","reason_code":null,"sequence":2,"stage_id":"INTAKE_VALIDATION","timestamp":"2026-07-21T18:57:21.012407+00:00","to_status":"RUNNING"},{"actor_id":"aegissec-dynamic-orchestrator","actor_type":"ENGINE","event_hash":"df31438db96cbec3f7e473fa71da258813c5645353d1638b0525e0f26988cc32","event_id":"AEG-EVT-2ECB678F3F4D4D333064","event_type":"STAGE_TRANSITION","from_status":"RUNNING","message":"Canonical input envelope verified.","metadata":{"component_count":17,"format":"CYCLONEDX_JSON","input_id":"AEG-INP-A904056AC16FAE4BCC61B63A","outputs":[{"artifact_type":"UNIFIED_INPUT_ENVELOPE","authority":"INPUT_EVIDENCE_ONLY","serialization":"CANONICAL_SORTED_JSON","sha256":"c78fab8b28f259d1c7d33d610ac06f6ff1b505f1b82825db4e107cc307736a04","source_path":"data/demo/aegissec_demo_project.cdx.json","stage_id":"INTAKE_VALIDATION"}],"warnings":["1 components have no resolved ecosystem."]},"previous_event_hash":"6ee48329cc90cba0df60b1abfbfba6b1081e3141dfc1e97ba761ebda721d6e02","reason_code":null,"sequence":3,"stage_id":"INTAKE_VALIDATION","timestamp":"2026-07-21T18:57:21.013024+00:00","to_status":"PASSED_WITH_WARNINGS"},{"actor_id":"aegissec-dynamic-orchestrator","actor_type":"ENGINE","event_hash":"7465284434543e68a07e0468247749087c9e054da52207624e4b8b54212465f4","event_id":"AEG-EVT-447DAA0B346329F43621","event_type":"STAGE_TRANSITION","from_status":"PENDING","message":"Executing governed adapter for ASSET_CONTEXT.","metadata":{"adapter_name":"asset_context_adapter","adapter_registered":true,"outputs":[],"warnings":[]},"previous_event_hash":"df31438db96cbec3f7e473fa71da258813c5645353d1638b0525e0f26988cc32","reason_code":null,"sequence":4,"stage_id":"ASSET_CONTEXT","timestamp":"2026-07-21T18:57:21.013345+00:00","to_status":"RUNNING"},{"actor_id":"aegissec-dynamic-orchestrator","actor_type":"ENGINE","event_hash":"95258315b1197679e22718ff88b9b9e62f97b8b2437df82978fc958c38f8205f","event_id":"AEG-EVT-77B323D1B99DE29ADDFE","event_type":"STAGE_TRANSITION","from_status":"RUNNING","message":"Controlled, previously validated asset context registered for the vertical slice.","metadata":{"asset_id":"AEG-AST-HOSP-SCHED-001","criticality":"high","internet_accessible":true,"outputs":[{"artifact_type":"CONTROLLED_ASSET_CONTEXT","authority":"AUTHORITATIVE_CONTEXT","serialization":"CANONICAL_SORTED_JSON","sha256":"df7aba8096ee4b2f9c0bc60754b094bbc639df5cf9b4b3bd573d7658df8b54f7","source_path":"data/sample_inputs/assets/valid_healthcare_asset.json","stage_id":"ASSET_CONTEXT"}],"warnings":["This adapter accepts the controlled validated sample asset. General uploaded asset validation will be integrated in a later stage."]},"previous_event_hash":"7465284434543e68a07e0468247749087c9e054da52207624e4b8b54212465f4","reason_code":null,"sequence":5,"stage_id":"ASSET_CONTEXT","timestamp":"2026-07-21T18:57:21.013806+00:00","to_status":"PASSED_WITH_WARNINGS"},{"actor_id":"aegissec-dynamic-orchestrator","actor_type":"ENGINE","event_hash":"c0756b287da03b22d90b2b9695d88d91981130ebd089ee0cfc1f1bff341f98d7","event_id":"AEG-EVT-AC1C1EF5F722E93542A7","event_type":"STAGE_TRANSITION","from_status":"PENDING","message":"Executing governed adapter for COMPONENT_CORRELATION.","metadata":{"adapter_name":"component_correlation_adapter","adapter_registered":true,"outputs":[],"warnings":[]},"previous_event_hash":"95258315b1197679e22718ff88b9b9e62f97b8b2437df82978fc958c38f8205f","reason_code":null,"sequence":6,"stage_id":"COMPONENT_CORRELATION","timestamp":"2026-07-21T18:57:21.014182+00:00","to_status":"RUNNING"},{"actor_id":"aegissec-dynamic-orchestrator","actor_type":"ENGINE","event_hash":"acf227b00ed76a59f6e06bc98b5272ea0b9f64f4967e3acd71712db1b38c74f5","event_id":"AEG-EVT-534A2AD2E87B577E7461","event_type":"STAGE_TRANSITION","from_status":"RUNNING","message":"Canonical components were correlated with the governed vulnerability risk mart.","metadata":{"cve_identifiers":["CVE-2016-1000027","CVE-2019-11358","CVE-2019-12086","CVE-2019-12308","CVE-2019-12384","CVE-2019-12781","CVE-2019-12814","CVE-2019-14232","CVE-2019-14233","CVE-2019-14234","CVE-2019-14235","CVE-2019-14379","CVE-2019-14439","CVE-2019-14540","CVE-2019-14892","CVE-2019-14893","CVE-2019-16335","CVE-2019-16942","CVE-2019-16943","CVE-2019-17267","CVE-2019-17531","CVE-2019-19118","CVE-2019-19844","CVE-2019-20330","CVE-2020-10650","CVE-2020-10672","CVE-2020-10673","CVE-2020-10968","CVE-2020-10969","CVE-2020-11111","CVE-2020-11112","CVE-2020-11113","CVE-2020-11619","CVE-2020-11620","CVE-2020-13254","CVE-2020-13596","CVE-2020-14060","CVE-2020-14061","CVE-2020-14062","CVE-2020-14195","CVE-2020-14343","CVE-2020-15168","CVE-2020-24583","CVE-2020-24584","CVE-2020-24616","CVE-2020-24750","CVE-2020-25649","CVE-2020-26137","CVE-2020-28500","CVE-2020-35490","CVE-2020-35491","CVE-2020-35728","CVE-2020-36179","CVE-2020-36180","CVE-2020-36181","CVE-2020-36182","CVE-2020-36183","CVE-2020-36184","CVE-2020-36185","CVE-2020-36186","CVE-2020-36187","CVE-2020-36188","CVE-2020-36189","CVE-2020-36518","CVE-2020-7212","CVE-2020-7471","CVE-2020-7598","CVE-2020-8203","CVE-2020-8840","CVE-2020-9402","CVE-2020-9546","CVE-2020-9547","CVE-2020-9548","CVE-2021-20190","CVE-2021-23337","CVE-2021-23437","CVE-2021-28658","CVE-2021-31542","CVE-2021-32052","CVE-2021-3281","CVE-2021-33203","CVE-2021-33503","CVE-2021-33571","CVE-2021-34552","CVE-2021-3749","CVE-2021-44228","CVE-2021-44420","CVE-2021-44832","CVE-2021-44906","CVE-2021-45046","CVE-2021-45105","CVE-2021-45115","CVE-2021-45116","CVE-2021-45452","CVE-2022-0235","CVE-2022-22815","CVE-2022-22816","CVE-2022-22817","CVE-2022-22818","CVE-2022-23539","CVE-2022-23540","CVE-2022-23541","CVE-2022-23833","CVE-2022-24303","CVE-2022-28346","CVE-2022-28347","CVE-2022-36359","CVE-2022-42003","CVE-2022-42004","CVE-2022-42889","CVE-2022-45198","CVE-2022-45199","CVE-2023-43804","CVE-2023-44271","CVE-2023-45803","CVE-2023-45857","CVE-2023-4863","CVE-2023-50447","CVE-2023-5129","CVE-2024-21907","CVE-2024-22243","CVE-2024-22259","CVE-2024-22262","CVE-2024-28219","CVE-2024-37891","CVE-2024-38809","CVE-2024-38820","CVE-2024-45231","CVE-2025-13465","CVE-2025-27152","CVE-2025-48432","CVE-2025-50181","CVE-2025-57833","CVE-2025-62718","CVE-2025-64458","CVE-2025-64459","CVE-2025-66418","CVE-2025-66471","CVE-2025-68161","CVE-2026-21441","CVE-2026-25639","CVE-2026-2950","CVE-2026-34477","CVE-2026-34480","CVE-2026-40175","CVE-2026-42033","CVE-2026-42034","CVE-2026-42035","CVE-2026-42036","CVE-2026-42038","CVE-2026-42039","CVE-2026-42040","CVE-2026-42041","CVE-2026-42042","CVE-2026-42043","CVE-2026-42308","CVE-2026-42310","CVE-2026-44431","CVE-2026-44486","CVE-2026-44487","CVE-2026-44490","CVE-2026-44492","CVE-2026-44495","CVE-2026-44496","CVE-2026-4800","CVE-2026-54059","CVE-2026-54060","CVE-2026-54514","CVE-2026-54515","CVE-2026-55379","CVE-2026-55380","CVE-2026-55798","CVE-2026-59199","CVE-2026-59205"],"matched_components":15,"outputs":[{"artifact_type":"COMPONENT_CORRELATION_SUMMARY","authority":"AUTHORITATIVE_CORRELATION","serialization":"CANONICAL_SORTED_JSON","sha256":"6615894bce1755a08f92428e5281bc4fef4205c095ff807013fd2a9bc4ab074b","stage_id":"COMPONENT_CORRELATION"}],"scan_eligible_components":17,"unmatched_components":2,"vulnerability_findings":403,"warnings":["2 scan-eligible components did not match the governed risk mart."]},"previous_event_hash":"c0756b287da03b22d90b2b9695d88d91981130ebd089ee0cfc1f1bff341f98d7","reason_code":null,"sequence":7,"stage_id":"COMPONENT_CORRELATION","timestamp":"2026-07-21T18:57:21.014666+00:00","to_status":"PASSED_WITH_WARNINGS"},{"actor_id":"aegissec-dynamic-orchestrator","actor_type":"ENGINE","event_hash":"1e43a040bebb041ec1d841a09cf9e01ceca10c2083d1f5a6475a5a0423e0625f","event_id":"AEG-EVT-BF8E422287EC8D2B624B","event_type":"STAGE_TRANSITION","from_status":"PENDING","message":"Executing governed adapter for EVIDENCE_ARBITRATION.","metadata":{"adapter_name":"evidence_arbitration_adapter","adapter_registered":true,"outputs":[],"warnings":[]},"previous_event_hash":"acf227b00ed76a59f6e06bc98b5272ea0b9f64f4967e3acd71712db1b38c74f5","reason_code":null,"sequence":8,"stage_id":"EVIDENCE_ARBITRATION","timestamp":"2026-07-21T18:57:21.015237+00:00","to_status":"RUNNING"},{"actor_id":"aegissec-dynamic-orchestrator","actor_type":"ENGINE","event_hash":"b68d62196478bb21322bc25ae8d4d3fa6d4b1d0eacaa08faf4d0c3719c765651","event_id":"AEG-EVT-AEB1F51470F1E1E0A407","event_type":"STAGE_TRANSITION","from_status":"RUNNING","message":"Evidence precedence and source authority were preserved.","metadata":{"live_source_precedence":true,"outputs":[{"artifact_type":"EVIDENCE_PRECEDENCE_DECISION","authority":"AUTHORITATIVE_GOVERNANCE","serialization":"CANONICAL_SORTED_JSON","sha256":"1c95f32661d9e2ab6ab172a7db4a25fb64b5dceea85c314108ddd0935461693f","stage_id":"EVIDENCE_ARBITRATION"}],"scanner_authority":"ADVISORY_ONLY","snapshot_authority":"HISTORICAL_READ_ONLY","snapshot_kev_cves"